{
  "schema_version": "1",
  "currency": "USD",
  "unit": "per_1m_tokens",
  "models": [
    {
      "provider": "anthropic",
      "model": "claude-fable-5-1",
      "aliases": [],
      "prices": [
        {
          "effective_from": "2026-09-23",
          "input": "10",
          "output": "50",
          "tiers": [],
          "source_url": "https://platform.claude.com/docs/en/about-claude/pricing",
          "retrieved_at": "2026-09-23"
        }
      ]
    },
    {
      "provider": "anthropic",
      "model": "claude-mythos-5-1",
      "aliases": [],
      "prices": [
        {
          "effective_from": "2026-09-23",
          "input": "10",
          "output": "50",
          "tiers": [],
          "source_url": "https://platform.claude.com/docs/en/about-claude/pricing",
          "retrieved_at": "2026-09-23",
          "notes": "Limited availability (Project Glasswing)."
        }
      ]
    },
    {
      "provider": "anthropic",
      "model": "claude-fable-5",
      "aliases": [],
      "prices": [
        {
          "effective_from": "2026-09-23",
          "input": "10",
          "output": "50",
          "tiers": [],
          "source_url": "https://platform.claude.com/docs/en/about-claude/pricing",
          "retrieved_at": "2026-09-23"
        }
      ]
    },
    {
      "provider": "anthropic",
      "model": "claude-mythos-5",
      "aliases": [],
      "prices": [
        {
          "effective_from": "2026-09-23",
          "input": "10",
          "output": "50",
          "tiers": [],
          "source_url": "https://platform.claude.com/docs/en/about-claude/pricing",
          "retrieved_at": "2026-09-23",
          "notes": "Limited availability (Project Glasswing)."
        }
      ]
    },
    {
      "provider": "anthropic",
      "model": "claude-opus-5-5",
      "aliases": [],
      "prices": [
        {
          "effective_from": "2026-09-23",
          "input": "4",
          "output": "20",
          "tiers": [],
          "source_url": "https://platform.claude.com/docs/en/about-claude/pricing",
          "retrieved_at": "2026-09-23"
        }
      ]
    },
    {
      "provider": "anthropic",
      "model": "claude-opus-5",
      "aliases": [],
      "prices": [
        {
          "effective_from": "2026-09-23",
          "input": "5",
          "output": "25",
          "tiers": [],
          "source_url": "https://platform.claude.com/docs/en/about-claude/pricing",
          "retrieved_at": "2026-09-23"
        }
      ]
    },
    {
      "provider": "anthropic",
      "model": "claude-opus-4-8",
      "aliases": [],
      "prices": [
        {
          "effective_from": "2026-09-23",
          "input": "5",
          "output": "25",
          "tiers": [],
          "source_url": "https://platform.claude.com/docs/en/about-claude/pricing",
          "retrieved_at": "2026-09-23"
        }
      ]
    },
    {
      "provider": "anthropic",
      "model": "claude-opus-4-7",
      "aliases": [],
      "prices": [
        {
          "effective_from": "2026-09-23",
          "input": "5",
          "output": "25",
          "tiers": [],
          "source_url": "https://platform.claude.com/docs/en/about-claude/pricing",
          "retrieved_at": "2026-09-23"
        }
      ]
    },
    {
      "provider": "anthropic",
      "model": "claude-opus-4-6",
      "aliases": [],
      "prices": [
        {
          "effective_from": "2026-09-23",
          "input": "5",
          "output": "25",
          "tiers": [],
          "source_url": "https://platform.claude.com/docs/en/about-claude/pricing",
          "retrieved_at": "2026-09-23"
        }
      ]
    },
    {
      "provider": "anthropic",
      "model": "claude-opus-4-5-20251101",
      "aliases": [
        "claude-opus-4-5"
      ],
      "prices": [
        {
          "effective_from": "2026-09-23",
          "input": "5",
          "output": "25",
          "tiers": [],
          "source_url": "https://platform.claude.com/docs/en/about-claude/pricing",
          "retrieved_at": "2026-09-23"
        }
      ]
    },
    {
      "provider": "anthropic",
      "model": "claude-opus-4-1-20250805",
      "aliases": [
        "claude-opus-4-1"
      ],
      "prices": [
        {
          "effective_from": "2026-09-23",
          "input": "15",
          "output": "75",
          "tiers": [],
          "source_url": "https://platform.claude.com/docs/en/about-claude/pricing",
          "retrieved_at": "2026-09-23",
          "notes": "Retired on the Claude API on 2026-08-05; kept for historical runs."
        }
      ]
    },
    {
      "provider": "anthropic",
      "model": "claude-opus-4-20250514",
      "aliases": [],
      "prices": [
        {
          "effective_from": "2026-09-23",
          "input": "15",
          "output": "75",
          "tiers": [],
          "source_url": "https://platform.claude.com/docs/en/about-claude/pricing",
          "retrieved_at": "2026-09-23",
          "notes": "Retired on the Claude API on 2026-06-15; kept for historical runs."
        }
      ]
    },
    {
      "provider": "anthropic",
      "model": "claude-sonnet-5",
      "aliases": [],
      "prices": [
        {
          "effective_from": "2026-09-23",
          "input": "2",
          "output": "10",
          "tiers": [],
          "source_url": "https://platform.claude.com/docs/en/about-claude/pricing",
          "retrieved_at": "2026-09-23",
          "notes": "The source states the launch price of $2/$10 is now the standard price; the increase planned for 2026-09-01 was cancelled."
        }
      ]
    },
    {
      "provider": "anthropic",
      "model": "claude-sonnet-4-6",
      "aliases": [],
      "prices": [
        {
          "effective_from": "2026-09-23",
          "input": "3",
          "output": "15",
          "tiers": [],
          "source_url": "https://platform.claude.com/docs/en/about-claude/pricing",
          "retrieved_at": "2026-09-23"
        }
      ]
    },
    {
      "provider": "anthropic",
      "model": "claude-sonnet-4-5-20250929",
      "aliases": [
        "claude-sonnet-4-5"
      ],
      "prices": [
        {
          "effective_from": "2026-09-23",
          "input": "3",
          "output": "15",
          "tiers": [],
          "source_url": "https://platform.claude.com/docs/en/about-claude/pricing",
          "retrieved_at": "2026-09-23"
        }
      ]
    },
    {
      "provider": "anthropic",
      "model": "claude-sonnet-4-20250514",
      "aliases": [],
      "prices": [
        {
          "effective_from": "2026-09-23",
          "input": "3",
          "output": "15",
          "tiers": [],
          "source_url": "https://platform.claude.com/docs/en/about-claude/pricing",
          "retrieved_at": "2026-09-23",
          "notes": "Retired on the Claude API on 2026-06-15; kept for historical runs."
        }
      ]
    },
    {
      "provider": "anthropic",
      "model": "claude-haiku-4-5-20251001",
      "aliases": [
        "claude-haiku-4-5"
      ],
      "prices": [
        {
          "effective_from": "2026-09-23",
          "input": "1",
          "output": "5",
          "tiers": [],
          "source_url": "https://platform.claude.com/docs/en/about-claude/pricing",
          "retrieved_at": "2026-09-23"
        }
      ]
    },
    {
      "provider": "anthropic",
      "model": "claude-3-5-haiku-20241022",
      "aliases": [],
      "prices": [
        {
          "effective_from": "2026-09-23",
          "input": "0.80",
          "output": "4",
          "tiers": [],
          "source_url": "https://platform.claude.com/docs/en/about-claude/pricing",
          "retrieved_at": "2026-09-23",
          "notes": "Claude Haiku 3.5. Retired on the Claude API on 2026-02-19; kept for historical runs."
        }
      ]
    }
  ]
}
