{
  "schema_version": "1",
  "currency": "USD",
  "unit": "per_1m_tokens",
  "models": [
    {
      "provider": "example",
      "model": "example-model",
      "aliases": [
        "example-model-2026-01-01"
      ],
      "prices": [
        {
          "effective_from": "2026-01-01",
          "input": "3",
          "output": "15",
          "tiers": [
            {
              "above_input_tokens": 200000,
              "input": "6",
              "output": "22.5"
            }
          ],
          "source_url": "https://example.com/pricing",
          "retrieved_at": "2026-09-23",
          "notes": "Fixture only."
        }
      ]
    }
  ]
}
